{
  "_id": "design",
  "template": "builtin:view",
  "description": "View of all design documents for a database - views and templates",
  "type": "list",
  "index": ["template"],
  "selector": {
    "template": {
      "$regex": "^builtin:"
    }
  },
  "columns": [
    {
      "id": "_id",
      "label": "Title",
      "type": "text"
    },
    {
      "id": "type",
      "label": "Type",
      "type": "text"
    }
  ]
}
