{
  "_id": "docs",
  "template": "builtin:view",
  "description": "Default view of a database's data documents",
  "type": "list",
  "index": ["template"],
  "selector": {
    "template": {
      "$regex": "^(?!builtin:.*$).*"
    }
  },
  "columns": [
    {
      "field": {
        "id": "title",
        "type": "text"
      },
      "label": "Title"
    },
    {
      "field": {
        "id": "created_at",
        "type": "date"
      },
      "label": "Created At"
    },
    {
      "field": {
        "id": "created_by",
        "type": "text"
      },
      "label": "Created By"
    }
  ]
}
